[
  {
    "schemaVersion": 1,
    "id": "classic",
    "name": "原版 · Classic",
    "nameEn": "Classic",
    "description": "保留熟悉的原版布局与全部旧配色。",
    "descriptionEn": "The original workspace, with every existing color preset.",
    "design": "classic",
    "defaultMode": "system",
    "colors": {
      "light": {
        "canvas": "#F7F8FA",
        "surface": "#FFFFFF",
        "raised": "#FFFFFF",
        "sunken": "#F1F3F5",
        "text": "#333333",
        "muted": "#596273",
        "subtle": "#697386",
        "border": "#E0E0E0",
        "accent": "#3B69A9",
        "success": "#237A50",
        "warning": "#946414",
        "error": "#C13F4B",
        "info": "#3B69A9",
        "plan": "#7163B5",
        "working": "#5466AF",
        "addition": "#237A50",
        "deletion": "#C13F4B",
        "terminalBg": "#F5F7FA",
        "terminalFg": "#283344"
      },
      "dark": {
        "canvas": "#1E1E1E",
        "surface": "#252526",
        "raised": "#2C2C2E",
        "sunken": "#19191B",
        "text": "#D4D4D4",
        "muted": "#B3B3BA",
        "subtle": "#96969F",
        "border": "#3C3C3C",
        "accent": "#007ACC",
        "success": "#72D6A1",
        "warning": "#E7B86A",
        "error": "#F28B91",
        "info": "#007ACC",
        "plan": "#B8ADFA",
        "working": "#AAB8FF",
        "addition": "#72D6A1",
        "deletion": "#F28B91",
        "terminalBg": "#15191F",
        "terminalFg": "#DCE3ED"
      }
    },
    "layout": {
      "navigation": "original",
      "radius": 6,
      "spacing": 16,
      "font": "system",
      "fontSize": 14,
      "lineHeight": 1.65,
      "sidebarWidth": 208,
      "contentWidth": 1200,
      "density": "comfortable",
      "panelStyle": "flat",
      "motion": "full"
    }
  },
  {
    "schemaVersion": 1,
    "id": "studio",
    "name": "Studio · 精工",
    "nameEn": "Studio · Precision",
    "description": "中性实色、细线分区与清晰排版，专注长时间编码。",
    "descriptionEn": "Neutral solid surfaces, fine dividers and precise typography for sustained work.",
    "design": "studio",
    "defaultMode": "light",
    "colors": {
      "light": {
        "canvas": "#F4F5F7",
        "surface": "#FFFFFF",
        "raised": "#FFFFFF",
        "sunken": "#EDEFF2",
        "text": "#20242C",
        "muted": "#586170",
        "subtle": "#6F7784",
        "border": "#DCE0E6",
        "accent": "#315FC4",
        "success": "#24744E",
        "warning": "#8A601D",
        "error": "#BB3E46",
        "info": "#315FC4",
        "plan": "#7552A0",
        "working": "#236D79",
        "addition": "#24744E",
        "deletion": "#BB3E46",
        "terminalBg": "#191D24",
        "terminalFg": "#E1E5EB"
      },
      "dark": {
        "canvas": "#14171C",
        "surface": "#1C2027",
        "raised": "#252A33",
        "sunken": "#171B21",
        "text": "#E4E8EE",
        "muted": "#ADB5C2",
        "subtle": "#919BAA",
        "border": "#343B47",
        "accent": "#91B4FF",
        "success": "#83CAA4",
        "warning": "#D7B77B",
        "error": "#EC9399",
        "info": "#91B4FF",
        "plan": "#BEA7DC",
        "working": "#82C4CD",
        "addition": "#83CAA4",
        "deletion": "#EC9399",
        "terminalBg": "#14171C",
        "terminalFg": "#E4E8EE"
      }
    },
    "layout": {
      "navigation": "original",
      "radius": 6,
      "spacing": 16,
      "font": "system",
      "fontSize": 14,
      "lineHeight": 1.65,
      "sidebarWidth": 208,
      "contentWidth": 1200,
      "density": "compact",
      "panelStyle": "flat",
      "motion": "full",
      "material": "solid",
      "texture": "none",
      "headingFont": "sans",
      "borderWidth": 1
    }
  },
  {
    "schemaVersion": 1,
    "id": "forge",
    "name": "Forge · 铸造",
    "nameEn": "Forge · Industrial",
    "description": "石墨底色、琥珀警示、硬边框与等宽工程排版。",
    "descriptionEn": "Graphite surfaces, amber signals, hard edges and technical typography.",
    "design": "forge",
    "defaultMode": "dark",
    "colors": {
      "light": {
        "canvas": "#E2E2D9",
        "surface": "#F5F5EC",
        "raised": "#FFFFFF",
        "sunken": "#D8D9D0",
        "text": "#1D221E",
        "muted": "#50594E",
        "subtle": "#65705F",
        "border": "#959D8E",
        "accent": "#A74610",
        "success": "#386531",
        "warning": "#855411",
        "error": "#AC3029",
        "info": "#315F82",
        "plan": "#72508D",
        "working": "#316A62",
        "addition": "#386531",
        "deletion": "#AC3029",
        "terminalBg": "#171B18",
        "terminalFg": "#DCE3D6"
      },
      "dark": {
        "canvas": "#151916",
        "surface": "#1D231F",
        "raised": "#29322B",
        "sunken": "#111612",
        "text": "#E5EADD",
        "muted": "#B2BDA8",
        "subtle": "#8D9C83",
        "border": "#4B594A",
        "accent": "#FFB454",
        "success": "#A2D67E",
        "warning": "#F3C677",
        "error": "#F48C77",
        "info": "#9EBFCB",
        "plan": "#C3ACD5",
        "working": "#80C5B0",
        "addition": "#A2D67E",
        "deletion": "#F48C77",
        "terminalBg": "#111612",
        "terminalFg": "#E5EADD"
      }
    },
    "layout": {
      "navigation": "original",
      "radius": 2,
      "spacing": 12,
      "font": "mono",
      "fontSize": 13,
      "lineHeight": 1.6,
      "sidebarWidth": 208,
      "contentWidth": 1400,
      "density": "compact",
      "panelStyle": "outlined",
      "motion": "full",
      "material": "solid",
      "texture": "grid",
      "headingFont": "mono",
      "borderWidth": 1
    }
  },
  {
    "schemaVersion": 1,
    "id": "tide",
    "name": "Tide · 潮汐",
    "nameEn": "Tide",
    "description": "雾青画布、海蓝光泽与柔和曲面，轻盈通透的海岸工作台。",
    "descriptionEn": "Sea-glass surfaces, ocean accents and soft curves for a calm coastal workspace.",
    "design": "tide",
    "defaultMode": "light",
    "colors": {
      "light": {
        "canvas": "#EDF5F7",
        "surface": "#FAFDFE",
        "raised": "#FFFFFF",
        "sunken": "#E3EFF2",
        "text": "#173642",
        "muted": "#486675",
        "subtle": "#587784",
        "border": "#C7DFE5",
        "accent": "#087F8C",
        "success": "#277552",
        "warning": "#98661C",
        "error": "#B64458",
        "info": "#256CA6",
        "plan": "#7660A3",
        "working": "#167C91",
        "addition": "#277552",
        "deletion": "#B64458",
        "terminalBg": "#102B36",
        "terminalFg": "#DDEEF3"
      },
      "dark": {
        "canvas": "#0B1C27",
        "surface": "#112B38",
        "raised": "#1A3947",
        "sunken": "#0D2330",
        "text": "#E0F2F5",
        "muted": "#AECAD3",
        "subtle": "#88ABB9",
        "border": "#2D5261",
        "accent": "#67D6D0",
        "success": "#8CD5AC",
        "warning": "#E9C17B",
        "error": "#F199AB",
        "info": "#88C6EF",
        "plan": "#BEADF0",
        "working": "#77CDDF",
        "addition": "#8CD5AC",
        "deletion": "#F199AB",
        "terminalBg": "#091A24",
        "terminalFg": "#DEEFF4"
      }
    },
    "layout": {
      "navigation": "original",
      "radius": 14,
      "spacing": 20,
      "font": "system",
      "fontSize": 14,
      "lineHeight": 1.7,
      "sidebarWidth": 208,
      "contentWidth": 1400,
      "density": "comfortable",
      "panelStyle": "elevated",
      "motion": "full",
      "material": "solid",
      "texture": "none",
      "headingFont": "sans",
      "borderWidth": 1
    }
  }
]
